{
  "schema_version": "ticket-repair-response/v1",
  "ticket_id": "RGR-P0A-02-C6",
  "finding_results": [
    {
      "finding_id": "F-1",
      "disposition": "propose_repair",
      "reason": "Case 6 canned stub response (override should succeed at self-report branch, but marker scan must still reject).",
      "source_refs_used": [
        { "path": ".claude/skills/ticket-rigor-gate/runner/fixtures/p0a02/evidence/evidence_shared.md", "lines": "1-3" }
      ],
      "patch": {
        "target_file": ".claude/skills/ticket-rigor-gate/runner/fixtures/p0a02/targets/target_c6.md",
        "target_section": null,
        "expected_old_text_hash": null,
        "replacement_text": "This introduces a new policy for escalation handling."
      },
      "changed_line_estimate": 1,
      "requires_human_decision": true,
      "verification_hints": []
    }
  ],
  "run_summary": {
    "model": "gpt-5.6-terra",
    "reasoning_effort": "medium",
    "prompt_template_version": "ticket-repair-prompt/v1"
  }
}
